Nombre,Precio
Brazalete Amazfit Gts 4 Mini Smartwatch 1.65 color rosa flamenco,$428.900
Reloj Inteligente Smartwatch Serie 8 T900 Pro Max L Negro Color de la caja Blanco,$66.444
Xiaomi Redmi Watch 5 Active Con Hyperos Bateria 18 Días Llamadas Ipx8 Negro,$203.900
Smart Watch T900 Promax L Serie 8 2.0 Color Negro,$49.900
Smartwatch Reloj Inteligente Deportivo Linkon Android,$159.990
Xiaomi Redmi Watch 5 Active Con Hyperos Bateria 18 Días Llamadas Ipx8 Gary,$154.076
Smartwatch Xiaomi Redmi Watch 5 Lite Amoled 1.96' Light Gold,$278.197
Redmi Watch 4 Silver Gray - Gris,$649.900
Reloj Inteligente Ip67 Impermeable Con Linterna,$223.000
Smartwatch Reloj Inteligente Deportivo Linkon Pro Llamadas,$199.990
Reloj inteligente Colmi P71 con pantalla de 19 pulgadas para Android/iOS carcasa negra pulsera negra bisel negro diseño de pulsera de malla,$125.000
"Samsung Galaxy Fit 3 Smartwatch Sport Gris Oscuro Pantalla AMOLED 1.6"" Resistencia Agua 50m",$333.167
Smart Watch T900 Promax L Serie 8 2.0 Color Negro,$49.900
"Genérica t800 ultra Negro Smartwatch display de 1.99"" con correa de gel de sílica",$32.900
Samsung Galaxy Fit 3 Silver,$274.875
Reloj Smartwatch Xiaomi Mi Band 8 Pro 1.74'' Malla Negro Caja Blanco Bisel Plateado oscuro Diseño de la malla Milanese,$269.995
Redmi Watch 4 Obsidian Black - Negro Version Global Bisel Gris oscuro,$348.999
Smartband Keluona ZL02 con correa de silicona - color negro,$84.645
Reloj Inteligente Para Mujer Con Llamada Bt Y Correa Extra,$159.000
Reloj Grado Militar Inteligente Running Hombre Smart Watch,$188.191
Reloj inteligente Smartwatch Colmi P71 con Bluetooth funda violeta bisel diseño de pulsera deportiva dorada,$125.000
Pulsera inteligente Smart Band Xiaomi Mi Band 9 Version Global,$164.679
Smart Watch Reloj Inteligente Z78 Ultra | Multi Funciones Color de la caja Plateado,$119.900
Samsung Galaxy Watch Watch 7 44mm Display De 1.47 Con Correa De Fkm - Color Khaki,$1.127.242
Smartwatch Reloj Inteligente Deportivo Linkon Pro Llamadas,$199.990
Reloj Smartwatch Xiaomi Redmi Watch 5 Lite 196 Amoled Bt Gps - Black,$299.000
Brazalete Amazfit Gts 4 Mini Smartwatch 1.65 color rosa flamenco,$428.900
"Xiaomi Series 8 Mi Band 8 display de 1.62"" con correa de silicona - color blanco",$134.355
Reloj Inteligente Series 8 Ultra Smart Watch T900 Deportivo,$41.500
Smartwatch Huawei Watch Fit 3 Negro,$611.000
